platform,content_type,engagement,engagement_zscore,text
twitter,tweet,147822,16.677,INSTEAD OF WATCHING NETFLIX TONIGHT. Spend 1 hour with this. Claude AI FULL COUR
instagram,reel,385973,13.526,Claude’s latest breakthroughs are putting serious pressure on GPT in the race to
linkedin,post,5205,12.608,New Anthropic research: Emotion concepts and their function in a large language 
reddit,post,31917,10.282,"Cancel your ChatGPT Plus, burn their compute on the way out, and switch to Claud"
youtube,video,191258,10.112,Bernie vs. Claude. I spoke to Anthropic’s AI agent Claude about AI collecting ma
tiktok,video,16328600,8.917,"Yes, this was filmed in silence…@Journey #bob #flight #duo #dreadhead #flying #p"
reddit,post,25345,8.067,"After 147 failed ChatGPT prompts, I had a breakdown and accidentally discovered "
tiktok,video,14089700,7.656,150K?!?! THANK YOU❤️ I love watching yall do this trend😊 #sugaronmytongue #foryo
youtube,video,135480,7.088,It’s time to switch from ChatGPT carterpcs tech chatgpt ai claude. It’s time to 
linkedin,post,2790,6.647,"Stupid simple, but most powerful Claude skill I run. Every Monday at 9am, Cowork"
tiktok,video,11499300,6.197,At no point in time should your significant other put their hands on you point b
reddit,post,19571,6.121,"Hey, OpenAI: Watch and f****** learn. This is how you stand up to power. [On Ant"
threads,thread,7510,6.023,"A statement from Anthropic CEO, Dario Amodei, on our discussions with the Depart"
threads,thread,7167,5.728,I'm Boris and I created Claude Code. I wanted to quickly share a few tips for us
threads,thread,6952,5.543,who all using Claude to make a personal dashboard? 👀 Please drop a screenshot of
instagram,reel,158052,5.394,Comment “Codes” and I’ll send you 100 more 👇 5 secret codes that make Claude 10x
threads,thread,6474,5.132,I'm Boris and I created Claude Code. Lots of people have asked how I use Claude 
youtube,video,92030,4.731,Tragic mistake... Anthropic leaks Claude’s source code. Anthropic accidentally l
linkedin,post,1965,4.611,I cloned 8 billionaires into one Claude Skill. (.. and i'm giving away the packa
threads,thread,5544,4.333,1. Claude (solve any problem) 2. Perplexity (research anything) 3. Gemini (gener
